{
  "schema_version": 1,
  "card_id": 432,
  "name": "Rush Recklessly",
  "card_type": "Spell",
  "tier": 2,
  "status": "scripted",
  "source_text": "Increase 1 monster's ATK by 700 points during the turn this card is activated.",
  "notes": [
    "Single-target ATK boost until the end of the turn."
  ],
  "scripts": [
    {
      "id": "432_boost_atk",
      "trigger": "on_activate",
      "operations": [
        {
          "op": "modify_atk",
          "target": "$target",
          "amount": 700,
          "mode": "flat"
        }
      ],
      "duration": "until_end_of_turn",
      "optional": false,
      "spell_speed": 2,
      "once_per_turn": false,
      "target": {
        "zone": "any_monster",
        "count": 1
      },
      "source_text": "Increase 1 monster's ATK by 700 points during the turn this card is activated."
    }
  ]
}
