{
  "schema_version": 1,
  "card_id": 149,
  "name": "Hinotama",
  "card_type": "Spell",
  "tier": 2,
  "status": "scripted",
  "source_text": "Inflicts 500 points of Direct Damage to your opponent's Life Points.",
  "notes": [
    "Single-clause burn."
  ],
  "scripts": [
    {
      "id": "149_damage_opponent",
      "trigger": "on_activate",
      "operations": [
        {
          "op": "inflict_damage",
          "amount": 500,
          "player": "opponent",
          "reason": "Hinotama"
        }
      ],
      "duration": "instant",
      "optional": false,
      "spell_speed": 1,
      "once_per_turn": false,
      "source_text": "Inflicts 500 points of Direct Damage to your opponent's Life Points."
    }
  ]
}
