{
  "schema_version": 1,
  "card_id": 205,
  "name": "Armed Ninja",
  "card_type": "Effect Monster",
  "tier": 2,
  "status": "scripted",
  "source_text": "FLIP: Destroys 1 Spell Card on the field. If this card's target is face-down, flip it face-up. If the card is a Spell Card, it is destroyed. If not, it is returned to its face-down position. The flipped card is not activated.",
  "notes": [
    "The engine knows the printed type, so only a Spell is selectable."
  ],
  "scripts": [
    {
      "id": "205_flip_destroy_spell",
      "trigger": "on_flip",
      "operations": [
        {
          "op": "destroy",
          "target": "$target",
          "reason": "Armed Ninja"
        }
      ],
      "duration": "instant",
      "optional": false,
      "spell_speed": 1,
      "once_per_turn": false,
      "condition": {
        "controller": "self",
        "face_up": true,
        "zone": "self_monster"
      },
      "target": {
        "zone": "any_spell_trap",
        "count": 1,
        "filter": {
          "card_type": "Spell"
        }
      },
      "source_text": "FLIP: Destroys 1 Spell Card on the field. If this card's target is face-down, flip it face-up. If the card is a Spell Card, it is destroyed. If not, it is returned to its face-down position. The flipped card is not activated."
    }
  ]
}
