{
  "schema_version": 1,
  "card_id": 955,
  "name": "Goblin Thief",
  "card_type": "Spell",
  "tier": 2,
  "status": "scripted",
  "source_text": "Inflict 500 points of damage to your opponent's Life Points and increase your Life Points by 500 points.",
  "notes": [
    "Fixed burn plus fixed heal."
  ],
  "scripts": [
    {
      "id": "955_goblin_thief",
      "trigger": "on_activate",
      "operations": [
        {
          "op": "inflict_damage",
          "amount": 500,
          "player": "opponent",
          "reason": "Goblin Thief"
        },
        {
          "op": "gain_lp",
          "amount": 500,
          "player": "self",
          "reason": "Goblin Thief"
        }
      ],
      "duration": "instant",
      "optional": false,
      "spell_speed": 1,
      "once_per_turn": false,
      "source_text": "Inflict 500 points of damage to your opponent's Life Points and increase your Life Points by 500 points."
    }
  ]
}
